{"artifact_kind":"external_simulation_run","assumptions":["initially_empty","fifo","two_identical_servers","constant_service","no_abandonment","deterministic_arrivals"],"claim":"finite_trace_under_supplied_inputs","evidence_kind":"model_generated","inputs":{"content":"eyJhcnJpdmFscyI6WyIwIiwiMiIsIjQiLCI2Il0sInNlcnZpY2VfbWludXRlcyI6IjMiLCJ1bml0IjoibWludXRlIn0K","encoding":"base64","sha256":"sha256:aba9b776a8325471cc7f54b9be271850960f2e26d36168e3f74b0a79ffbc3291"},"model":{"content":"IiIiQWRhcHRlZCBmcm9tIFNpbVB5IDQuMS4xIHNoYXJlZF9yZXNvdXJjZXMucnN0IChNSVQ7IHNlZSBMSUNFTlNFLnNpbXB5LnR4dCkuCgpTaW1QeSBvd25zIGV2ZW50IHNjaGVkdWxpbmcgYW5kIHJlc291cmNlIGFjcXVpc2l0aW9uLiBUaGlzIGFkYXB0ZXIgc3VwcGxpZXMgZXhwbGljaXQKaW50ZWdlciBpbnB1dHMgYW5kIHJlY29yZHMgdGhlIHJlc3VsdGluZyBwZXItY2FyIHRyYWNlOyBpdCBpbXBsZW1lbnRzIG5vIHNpbXVsYXRvci4KIiIiCmltcG9ydCBqc29uCmltcG9ydCBzeXMKCmltcG9ydCBzaW1weQoKCmRlZiBydW4oaW5wdXRzKToKICAgIGVudiA9IHNpbXB5LkVudmlyb25tZW50KCkKICAgIHJlc291cmNlID0gc2ltcHkuUmVzb3VyY2UoZW52LCBjYXBhY2l0eT0yKQogICAgcm93cyA9IFtOb25lXSAqIGxlbihpbnB1dHNbImFycml2YWxzIl0pCgogICAgZGVmIGNhcihpbmRleCwgYXJyaXZhbCk6CiAgICAgICAgeWllbGQgZW52LnRpbWVvdXQoYXJyaXZhbCkKICAgICAgICB3aXRoIHJlc291cmNlLnJlcXVlc3QoKSBhcyByZXF1ZXN0OgogICAgICAgICAgICB5aWVsZCByZXF1ZXN0CiAgICAgICAgICAgIHN0YXJ0ID0gZW52Lm5vdwogICAgICAgICAgICB5aWVsZCBlbnYudGltZW91dChpbnQoaW5wdXRzWyJzZXJ2aWNlX21pbnV0ZXMiXSkpCiAgICAgICAgICAgIHJvd3NbaW5kZXhdID0geyJjYXIiOiBzdHIoaW5kZXgpLCAiYXJyaXZhbCI6IHN0cihhcnJpdmFsKSwKICAgICAgICAgICAgICAgICAgICAgICAgICAgInN0YXJ0Ijogc3RyKHN0YXJ0KSwgImZpbmlzaCI6IHN0cihlbnYubm93KX0KCiAgICBmb3IgaW5kZXgsIGFycml2YWwgaW4gZW51bWVyYXRlKGlucHV0c1siYXJyaXZhbHMiXSk6CiAgICAgICAgZW52LnByb2Nlc3MoY2FyKGluZGV4LCBpbnQoYXJyaXZhbCkpKQogICAgZW52LnJ1bigpCiAgICByZXR1cm4geyJ1bml0IjogIm1pbnV0ZSIsICJyb3dzIjogcm93c30KCgppZiBfX25hbWVfXyA9PSAiX19tYWluX18iOgogICAgd2l0aCBvcGVuKHN5cy5hcmd2WzFdLCAicmIiKSBhcyBzb3VyY2U6CiAgICAgICAgaW5wdXRzID0ganNvbi5sb2FkKHNvdXJjZSkKICAgIHByaW50KGpzb24uZHVtcHMocnVuKGlucHV0cyksIHNvcnRfa2V5cz1UcnVlLCBzZXBhcmF0b3JzPSgiLCIsICI6IikpKQo=","encoding":"base64","sha256":"sha256:22b76f26b874c56bf136df0472d447ce85eec584c277ee853c5ed5625b205898"},"output":{"content":"eyJyb3dzIjpbeyJhcnJpdmFsIjoiMCIsImNhciI6IjAiLCJmaW5pc2giOiIzIiwic3RhcnQiOiIwIn0seyJhcnJpdmFsIjoiMiIsImNhciI6IjEiLCJmaW5pc2giOiI1Iiwic3RhcnQiOiIyIn0seyJhcnJpdmFsIjoiNCIsImNhciI6IjIiLCJmaW5pc2giOiI3Iiwic3RhcnQiOiI0In0seyJhcnJpdmFsIjoiNiIsImNhciI6IjMiLCJmaW5pc2giOiI5Iiwic3RhcnQiOiI2In1dLCJ1bml0IjoibWludXRlIn0K","encoding":"base64","sha256":"sha256:0b93162615c92f057ab849bef42b0e9e270da9276ea67a97769ecbcd4d7aa3ab"},"package":{"name":"simpy","sdist_sha256":"sha256:06d0750a7884b11e0e8e20ce0bc7c6d4ed5f1743d456695340d13fdff95001a6","source_manifest":{"simpy/__init__.py":"sha256:9a15ad441b4e1c59b1391c698f512caeb547ee936c96d633f2f841c10cd3a246","simpy/core.py":"sha256:0274b36d9dda5c0901b8d765885705bbe76640e24da1bc63e679433e0f9c49dd","simpy/events.py":"sha256:7cba6e717092cee1b0d51ed33b83a2f51f055dc3327c894bf99122c3bfa16b4d","simpy/exceptions.py":"sha256:9b29a23cee188bb94d9cc0ea0dff98916cac2789fe4d6375815976b69f98db76","simpy/resources/__init__.py":"sha256:85376d218f852a766427d1074379aa79b76bbbfa746d496f8bdff6621c254255","simpy/resources/base.py":"sha256:20dc903861a382b42772c9daec7ad79ae9fc87d076341bd3f3297dd6c34d1da1","simpy/resources/container.py":"sha256:2721dacd16fe46c3fc1ff027cd65ae8f5f090a1eaf3850bb7eb2ec778e37f3bd","simpy/resources/resource.py":"sha256:e184fb6ab518d23552f8ac1b05fb52ad854f5045a62814e531f6ca4353204e05","simpy/resources/store.py":"sha256:5731066d0126fd68c1ee798a23927a65d4ebf14c7e89bfce5ce703494c77bbe7","simpy/rt.py":"sha256:6d51d90a0badc6d08d0bdbc67ffe589398af0bd430bb74c46f0cddabff6d2b6d","simpy/util.py":"sha256:e4270b11b743ff4fd1fab86bff08a9b464219a02190d9725cf6d87006603f49c"},"version":"4.1.1"},"profile":"simpy-resource-fifo.v1","runtime":{"implementation":"CPython","randomness":"none","time_arithmetic":"integer","version":"3.13.15"},"schema_version":"0.1.0","upstream_example_sha256":"sha256:a9b2265ecff3aa6542a7814ce419252b61e10abec84daba552d696c86457cdcd"}
